{
  "run_id": "p1/fr-4",
  "proof_id": "p1",
  "declaration_id": "p1/fd-3",
  "environment_hash": "sha256:c3c3c3c3c3c3c3c3c3c3c3c3c3c3c3c3c3c3c3c3c3c3c3c3c3c3c3c3c3c3c3c3",
  "disposition": "stagnated",
  "root_state_id": "p1/fs-9",
  "checkpoint": {
    "epoch_ms": 1724419380000,
    "frontier_state_ids": ["p1/fs-10"]
  },
  "states": [
    {
      "state_id": "p1/fs-9",
      "kind": "or",
      "goal_text": "\u03a3 k=1..n k = n(n+1)/2",
      "exact_state_hash": "sha256:5959595959595959595959595959595959595959595959595959595959595959",
      "semantic_signature": "sha256:6969696969696969696969696969696969696969696969696969696969696969",
      "status": "expanded"
    },
    {
      "state_id": "p1/fs-10",
      "kind": "or",
      "goal_text": "inductive step: \u03a3 k=1..(n+1) = ((n+1)(n+2))/2 given IH",
      "exact_state_hash": "sha256:5a5a5a5a5a5a5a5a5a5a5a5a5a5a5a5a5a5a5a5a5a5a5a5a5a5a5a5a5a5a5a5a",
      "semantic_signature": "sha256:6a6a6a6a6a6a6a6a6a6a6a6a6a6a6a6a6a6a6a6a6a6a6a6a6a6a6a6a6a6a6a6a",
      "status": "open"
    }
  ],
  "tactic_edges": [
    {
      "tactic_id": "p1/ta-6",
      "source_state_id": "p1/fs-10",
      "tactic_label": "rw",
      "tactic_args": ["Finset.sum_range_succ"],
      "executor_result": "lean-rejected",
      "subgoal_count": 0,
      "produced_goal_ids": [],
      "diagnostic_artifact": "sha256:7373737373737373737373737373737373737373737373737373737373737373",
      "status": "dead",
      "annotations": {"failure_family": "unknown-identifier"}
    }
  ],
  "obstructions": [
    {
      "obstruction_id": "p1/obs-2",
      "kind": "library-gap",
      "formal_run_id": "p1/fr-4",
      "formal_state_ids": ["p1/fs-10"],
      "minimal_state_artifact": "sha256:7474747474747474747474747474747474747474747474747474747474747474",
      "diagnostic_artifacts": [
        "sha256:7373737373737373737373737373737373737373737373737373737373737373"
      ],
      "repeated_failure_family": "unknown-identifier",
      "premises_considered": ["Finset.sum_range_succ", "Nat.sum_range_add"],
      "tactic_families_considered": ["rw", "simp", "induction"],
      "evidence": [
        {
          "kind": "heuristic-optimizer",
          "note": "same failure family across 12 tactic attempts"
        }
      ],
      "suggested_escalation": "premise-expansion",
      "environment_hash": "sha256:c3c3c3c3c3c3c3c3c3c3c3c3c3c3c3c3c3c3c3c3c3c3c3c3c3c3c3c3c3c3c3c3"
    }
  ],
  "artifacts": [],
  "budget_used": {
    "tactic_steps": 300,
    "wall_clock_ms": 45000
  }
}
